ticker,date,source,headline,vader_score,vader_label
MSFT,23-09-2024,Yahoo Canada Finance,Microsoft stock receives rare downgrade as analyst says it's 'beholden' to Nvidia,0.0,neutral
MSFT,23-09-2024,Yahoo Finance,Microsoft stock receives rare downgrade as analyst says it's 'beholden' to Nvidia,0.0,neutral
MSFT,19-09-2024,Yahoo Finance,"1 Stock-Split Stock Set to Join Nvidia, Apple, Microsoft, Amazon, Alphabet, and Meta In the $1 Trillion Club",0.4404,positive
MSFT,18-09-2024,TechRadar,Microsoft announces biggest-ever share buyback scheme to help boost investment,0.765,positive
MSFT,17-09-2024,CNBC,Here are the fundamental and the technical reasons that Microsoft stock can be bought,0.0,neutral
MSFT,17-09-2024,Yahoo Finance,"Midday stock movers: Microsoft, Intel, Dell",0.0,neutral
MSFT,17-09-2024,Yahoo Finance,Microsoft Raises Its Dividend 10% and Announces $60B Stock Buyback Program,0.0,neutral
MSFT,04-09-2024,CNBC,Cramer names Microsoft (MSFT) as No. 1 underappreciated megacap to buy,0.0,neutral
MSFT,01-11-2024,Motley Fool Australia,Why Microsoft stock is sinking today,0.0,neutral
MSFT,31-10-2024,GuelphToday,"Stock market today: Microsoft, Meta and the burden of expectations knock Wall Street sharply lower",-0.6249,negative
MSFT,31-10-2024,ElliotLakeToday.com,"Stock market today: Microsoft, Meta and the burden of expectations knock Wall Street sharply lower",-0.6249,negative
MSFT,31-10-2024,BradfordToday,"Stock market today: Microsoft, Meta and the burden of expectations knock Wall Street sharply lower",-0.6249,negative
MSFT,31-10-2024,BayToday,"Stock market today: Microsoft, Meta and the burden of expectations knock Wall Street sharply lower",-0.6249,negative
MSFT,31-10-2024,SooToday,"Stock market today: Microsoft, Meta and the burden of expectations knock Wall Street sharply lower",-0.6249,negative
MSFT,31-10-2024,Vancouver Is Awesome,"Stock market today: Microsoft, Meta and the burden of expectations knock Wall Street sharply lower",-0.6249,negative
MSFT,31-10-2024,CNBC,Microsoft stock has worst day in two years on disappointing forecast,-0.8074,negative
MSFT,31-10-2024,ElliotLakeToday.com,Stock market today: Wall Street opens lower as Big Tech stocks pull back,-0.296,negative
MSFT,31-10-2024,Vancouver Is Awesome,Stock market today: Wall Street opens lower as Big Tech stocks pull back,-0.296,negative
MSFT,29-11-2024,Yahoo Finance,"Microsoft FTC probe 'not a complete shocker,' analyst says",0.1139,positive
MSFT,19-11-2024,Investor's Business Daily,C3.ai Jumps On Microsoft Cloud Partnership Targeting Enterprise Market,0.0,neutral
MSFT,08-11-2024,Firstpost,"NVIDIA stock rallies to record high as Trump’s re-election causes frenzy in AI, chip sector",-0.3182,negative
MSFT,04-11-2024,Yahoo Finance,"Constellation Energy, nuclear stocks plummet after regulators block Amazon power deal",-0.0258,neutral
MSFT,04-11-2024,Yahoo Canada Finance,"Constellation Energy, nuclear stocks plummet after regulators block Amazon power deal",-0.0258,neutral
MSFT,01-11-2024,Motley Fool Australia,Why Microsoft stock is sinking today,0.0,neutral
MSFT,30-12-2024,Yahoo Finance,"How major US stock indexes fared Monday, 12",0.0,neutral
MSFT,25-12-2024,Yahoo Finance,Analyst reworks Microsoft stock price target in software review,0.0,neutral
MSFT,22-12-2024,Yahoo Canada Finance,Billionaire Steve Ballmer has more than 80% of his portfolio in Microsoft stock and advises everyday investors to ‘keep it simple’,0.0,neutral
MSFT,16-12-2024,Motley Fool Australia,Guess which ASX 200 tech stock just crashed 13% on news from Microsoft?,0.0,neutral
MSFT,12-12-2024,Yahoo Finance,Veteran trader reviews Microsoft stock price target after bitcoin showdown,0.0,neutral
MSFT,12-12-2024,Investor's Business Daily,Stock Market Today,0.0,neutral
MSFT,11-12-2024,Investor's Business Daily,"Microsoft Stock Surpasses New Buy Point, Posts Highest Close In Nearly 5 Months; Why It's A Buy Again",0.0,neutral
MSFT,10-12-2024,Yahoo Finance,"Bill Gates Could Go Bankrupt If Tesla Stock Surges 200% To Become The Top Company, Says Elon Musk",-0.4215,negative
MSFT,08-12-2024,Yahoo Finance,"Meet the Stock-Split Stock That Soared 10,610% Over the Past 15 Years. It's Poised to Join Apple, Nvidia, Microsoft, Amazon, Alphabet, and Meta in the $1 Trillion Club by 2025.",0.5994,positive
MSFT,06-12-2024,Windows Central,Microsoft ends production on Surface Studio 2+ as stock dwindles,0.0,neutral
